{
  "schema_version": "1.0",
  "generated_at": "2026-08-12T11:27:12Z",
  "mock": false,
  "years": [
    2023,
    2024,
    2025
  ],
  "months": [
    {
      "number": 1,
      "name": "Janeiro"
    },
    {
      "number": 2,
      "name": "Fevereiro"
    },
    {
      "number": 3,
      "name": "Março"
    },
    {
      "number": 4,
      "name": "Abril"
    },
    {
      "number": 5,
      "name": "Maio"
    },
    {
      "number": 6,
      "name": "Junho"
    },
    {
      "number": 7,
      "name": "Julho"
    },
    {
      "number": 8,
      "name": "Agosto"
    },
    {
      "number": 9,
      "name": "Setembro"
    },
    {
      "number": 10,
      "name": "Outubro"
    },
    {
      "number": 11,
      "name": "Novembro"
    },
    {
      "number": 12,
      "name": "Dezembro"
    }
  ],
  "priorities": [
    {
      "code": 1,
      "name": "Crítica"
    },
    {
      "code": 2,
      "name": "Alta"
    },
    {
      "code": 3,
      "name": "Média"
    },
    {
      "code": 4,
      "name": "Baixa"
    },
    {
      "code": 5,
      "name": "Muito Baixa"
    }
  ],
  "products": [
    "ets",
    "khafl",
    "khch",
    "khem",
    "khep",
    "khga",
    "khhc",
    "khhj",
    "khhn",
    "khkm",
    "khsi",
    "khst",
    "khvp",
    "larq",
    "lbho",
    "lcem",
    "lcho",
    "lcle",
    "lclo",
    "lcos",
    "lcsi",
    "lcsp",
    "lema",
    "lemg",
    "lemn",
    "lexc",
    "lgoa",
    "lhco",
    "lhvp",
    "ljel",
    "llwm",
    "lmse",
    "lofc",
    "lost",
    "lrdo",
    "lrel",
    "lrev",
    "lsaa",
    "lsd0",
    "lsg2",
    "lsin",
    "lsmt",
    "lssl",
    "lsto",
    "lvmr",
    "lvpk",
    "lvps",
    "lwpl",
    "minf",
    "ncpu",
    "ninf"
  ],
  "categories": [
    "cat1",
    "cat10",
    "cat100",
    "cat101",
    "cat102",
    "cat103",
    "cat104",
    "cat105",
    "cat106",
    "cat107",
    "cat108",
    "cat109",
    "cat11",
    "cat110",
    "cat111",
    "cat112",
    "cat113",
    "cat114",
    "cat115",
    "cat116",
    "cat117",
    "cat118",
    "cat119",
    "cat12",
    "cat120",
    "cat121",
    "cat122",
    "cat123",
    "cat124",
    "cat125",
    "cat126",
    "cat127",
    "cat128",
    "cat129",
    "cat13",
    "cat130",
    "cat131",
    "cat132",
    "cat133",
    "cat134",
    "cat135",
    "cat136",
    "cat137",
    "cat138",
    "cat139",
    "cat14",
    "cat140",
    "cat141",
    "cat15",
    "cat16",
    "cat17",
    "cat18",
    "cat19",
    "cat2",
    "cat20",
    "cat21",
    "cat22",
    "cat23",
    "cat24",
    "cat25",
    "cat26",
    "cat27",
    "cat28",
    "cat29",
    "cat3",
    "cat30",
    "cat31",
    "cat32",
    "cat33",
    "cat34",
    "cat35",
    "cat36",
    "cat37",
    "cat38",
    "cat39",
    "cat4",
    "cat40",
    "cat41",
    "cat42",
    "cat43",
    "cat44",
    "cat45",
    "cat46",
    "cat47",
    "cat48",
    "cat49",
    "cat5",
    "cat50",
    "cat51",
    "cat52",
    "cat53",
    "cat54",
    "cat55",
    "cat56",
    "cat57",
    "cat58",
    "cat59",
    "cat6",
    "cat60",
    "cat61",
    "cat62",
    "cat63",
    "cat64",
    "cat65",
    "cat66",
    "cat67",
    "cat68",
    "cat69",
    "cat7",
    "cat70",
    "cat71",
    "cat72",
    "cat73",
    "cat74",
    "cat75",
    "cat76",
    "cat77",
    "cat78",
    "cat79",
    "cat8",
    "cat80",
    "cat81",
    "cat82",
    "cat83",
    "cat84",
    "cat85",
    "cat86",
    "cat87",
    "cat88",
    "cat89",
    "cat9",
    "cat90",
    "cat91",
    "cat92",
    "cat93",
    "cat94",
    "cat95",
    "cat96",
    "cat97",
    "cat98",
    "cat99"
  ],
  "teams": [
    "Team01",
    "Team02",
    "Team03",
    "Team04",
    "Team05",
    "Team06",
    "Team07",
    "Team08",
    "Team09",
    "Team10",
    "Team11",
    "Team12",
    "Team13",
    "Team14",
    "Team15",
    "Team16",
    "Team17"
  ]
}